practice,country,summary,img,audio
"Mongol Tuuli, Mongolian epic",Mongolia,"The Mongolian Tuuli is an oral tradition comprising heroic epics that run from hundreds to thousands of lines and combine benedictions, eulogies, spells, idiomatic phrases, fairy tales, myths and folk songs. They are regarded as a living encyclopaedia of Mongolian oral traditions and immortalize the heroic history of the Mongolian people. Epic singers are distinguished by their prodigious memory and performance skills, combining singing, vocal improvisation and musical composition coupled with theatrical elements. Epic lyrics are performed to musical accompaniment on instruments such as the morin khuur (horse-head fiddle) and tovshuur (lute). Epics are performed during many social and public events, including state affairs, weddings, a child’s first haircut, the naadam (a wrestling, archery and horseracing festival) and the worship of sacred sites. Epics evolved over many centuries, and reflect nomadic lifestyles, social behaviours, religion, mentalities and imagination. Performing artists cultivate epic traditions from generation to generation, learning, performing and transmitting techniques within kinship circles, from fathers to sons. Through the epics, Mongolians transmit their historical knowledge and values to younger generations, strengthening awareness of national identity, pride and unity. Today, the number of epic trainers and learners is decreasing. With the gradual disappearance of the Mongol epic, the system of transmitting historic and cultural knowledge is degrading.",N/A,N/A
Qiang New Year festival,China,"The Qiang New Year Festival, held on the first day of the tenth lunar month, is an occasion for the Qiang people of China’s Sichuan Province to offer thanks and worship to heaven for prosperity, reaffirm their harmonious and respectful relationship with nature, and promote social and family harmony. The solemn ritual sacrifice of a goat to the mountain is performed by villagers clad in their finest ceremonial dress, under the careful direction of a shibi (priest). This is followed by the communal sheepskin-drum and salang dances, led by the shibi. The ensuing festivities combine merrymaking with the chanting of traditional Qiang epics by the shibi, singing and the drinking of wine. At the end of the day the heads of families preside over family worship during which sacrifices and offerings are made. Through the festival, Qiang traditions distilling history and cultural information are renewed and diffused, and social behaviours are reinforced, the community expressing respect and worship towards all creatures, the motherland and their ancestors. Participation in the festival has declined in recent years due to migration, declining interest in Qiang heritage among the young and the impact of outside cultures, but the 2008 Sichuan earthquake that destroyed many of the Qiang villages and devastated the region put the New Year festival at grave risk.",N/A,N/A
Rite of the Kalyady Tsars (Christmas Tsars),Belarus,"The Kalyady Tsars (Christmas Tsars) is a ritual and festive event celebrated in the village of Semezhava in the Minsk region of Belarus. Typical Belarusian New Year celebrations take place according to the ‘old’ Julian style calendar and are combined with distinctive local performing arts. About 500 men participate annually in the event, of which seven are chosen to play the roles of ‘Kalyady Tsars’ in the national historical-religious drama ‘Tsar Maximilian’. Additional comic characters of the dzad (old man) and baba (old lady), played by a young girl and boy respectively, interact with the audience. During the drama, ‘tsars’ visit the local houses of unmarried girls to give comic performances and receive good wishes and awards. The procession continues into the night, lit by torchlight. The incorporation of dramatic allusions to aspects of modern life as well as to ethnic communities, groups and individuals has established the drama as a vivid example of cultural diversity. At present, the ceremony, although popular with older residents, is diminishing in popularity with the younger generation. This may result in a gap in transmission of knowledge regarding the production of costumes, instruments, interior decorations and particular dishes associated with the event – intangible heritage that may not outlast the present generation of residents.",N/A,N/A
"Sanké mon, collective fishing rite of the Sanké",Mali,"The Sanké mon collective fishing rite takes place in San in the Ségou region of Mali every second Thursday of the seventh lunar month to commemorate the founding of the town. The rite begins with the sacrifice of roosters, goats and offerings made by village residents to the water spirits of the Sanké pond. The collective fishing then takes place over fifteen hours using large and small mesh fishing nets. It is immediately followed by a masked dance on the public square featuring Buwa dancers from San and neighbouring villages who wear traditional costumes and hats decorated with cowrie shells and feathers and perform specific choreography to the rhythms of a variety of drums. Traditionally, the Sanké mon rite marks the beginning of the rainy season. It is also is an expression of local culture through arts and crafts, knowledge and know-how in the fields of fisheries and water resources. It reinforces collective values of social cohesion, solidarity and peace between local communities. In recent years, the rite has seen a decrease in popularity that threatens to endanger its existence, contributory factors including ignorance of the event’s history and importance, a gradual decrease in attendance, occasional accidents during the event itself and the degradation of the Sanké lake due to poor rainfall and the effects of urban development. ",N/A,N/A
Suiti cultural space,Latvia,"The Suiti are a small Catholic community in the Protestant (Lutheran) western part of Latvia. The Suiti cultural space is characterized by a number of distinct features, including vocal drone singing performed by Suiti women, wedding traditions, colourful traditional costumes, the Suiti language, local cuisine, religious traditions, celebrations of the annual cycle, and a remarkable number of folk songs, dances and melodies recorded in this community. Older forms of extended family structures are still common here, and such families, where the transfer of skills from generation to generation takes place, are important bastions of Suiti cultural heritage. The synthesis of pre-Christian traditions and religious rituals has created a unique blend of intangible cultural heritage in the Suiti community. The pillar of Suiti identity – the Catholic Church – successfully recovered following the Soviet period and as a result, the Suiti cultural space has experienced a gradual renaissance. However, today only a few, mostly old people, have a good knowledge of Suiti cultural heritage, and thus there is an urgent need to disseminate this knowledge and to involve more people in its preservation by recovering elements preserved only in written documents, film archives and museum depositaries.",N/A,N/A
Traditional design and practices for building Chinese wooden arch bridges,China,"Wooden arch bridges are found in Fujian Province and Zhejiang Province, along China’s south-east coast. The traditional design and practices for building these bridges combine the use of wood, traditional architectural tools, craftsmanship, the core technologies of ‘beam-weaving’ and mortise and tenon joints, and an experienced woodworker’s understanding of different environments and the necessary structural mechanics. The carpentry is directed by a woodworking master and implemented by other woodworkers. The craftsmanship is passed on orally and through personal demonstration, or from one generation to another by masters teaching apprentices or relatives within a clan in accordance with strict procedures. These clans play an irreplaceable role in building, maintaining and protecting the bridges. As carriers of traditional craftsmanship the arch bridges function as both communication tools and venues. They are important gathering places for local residents to exchange information, entertain, worship and deepen relationships and cultural identity. The cultural space created by traditional Chinese arch bridges has provided an environment for encouraging communication, understanding and respect among human beings. The tradition has declined however in recent years due to rapid urbanization, scarcity of timber and lack of available construction space, all of which combine to threaten its transmission and survival.",N/A,N/A
"Traditional Li textile techniques: spinning, dyeing, weaving and embroidering",China,"The traditional Li textile techniques of spinning, dyeing, weaving and embroidering are employed by women of the Li ethnic group of Hainan Province, China, to make cotton, hemp and other fibres into clothing and other daily necessities. The techniques involved, including warp ikat, double-face embroidery, and single-face jacquard weaving, are passed down from mothers to daughters from early childhood through verbal instruction and personal demonstration. Li women design the textile patterns using only their imagination and knowledge of traditional styles. In the absence of a written language, these patterns record the history and legends of Li culture as well as aspects of worship, taboos, beliefs, traditions and folkways. The patterns also distinguish the five major spoken dialects of Hainan Island. The textiles form an indispensable part of important social and cultural occasions such as religious rituals and festivals, and in particular weddings, for which Li women design their own dresses. As carriers of Li culture, traditional Li textile techniques are an indispensable part of the cultural heritage of the Li ethnic group. However, in recent decades the numbers of women with the weaving and embroidery skills at their command has severely declined to the extent that traditional Li textile techniques are exposed to the risk of extinction and are in urgent need of protection.",N/A,N/A
Traditional music of the Tsuur,Mongolia,"Tsuur music is based on a combination of instrumental and vocal performance – a blending of sounds created simultaneously by both the musical instrument and the human throat. Tsuur music has an inseparable connection to the Uriankhai Mongolians of the Altai Region, and remains an integral part of their daily life. Its origins lie in an ancient practice of worshipping nature and its guardian spirits by emulating natural sounds. The Tsuur is a vertical pipe-shaped wooden wind instrument with three fingerholes. Simultaneously touching the mouthpiece of the pipe with one’s front teeth and applying one’s throat produces a unique timbre comprising a clear and gentle whistling sound and a drone. The Tsuur is traditionally played to ensure success for hunts, for benign weather, as a benediction for safe journeys or for weddings and other festivities. The music reflects one’s inner feelings when travelling alone, connects a human to nature, and serves as a performing art. The Tsuur tradition has faded over recent decades as a consequence of negligence and animosity toward folk customs and religious faith, leaving many locales with no Tsuur performer and no families possessing a Tsuur. The forty known pieces preserved among the Uriankhai Mongolians are transmitted exclusively through the memory of successive generations – a feature making this art highly vulnerable to the risk of disappearing.",N/A,N/A
Traditions and practices associated with the Kayas in the sacred forests of the Mijikenda,Kenya,"The Mijikenda include nine Bantu-speaking ethnic groups in the Kaya forests of coastal Kenya. The identity of the Mijikenda is expressed through oral traditions and performing arts related to the sacred forests, which are also sources of valuable medicinal plants. These traditions and practices constitute their codes of ethics and governance systems, and include prayers, oath-taking, burial rites and charms, naming of the newly born, initiations, reconciliations, marriages and coronations. Kayas are fortified settlements whose cultural spaces are indispensable for the enactment of living traditions that underscore the identity, continuity and cohesion of the Mijikenda communities. The use of natural resources within the Kayas is regulated by traditional knowledge and practices that have contributed to the conservation of their biodiversity. The Kambi (Councils of Elders) acts as the custodians of these Kayas and the related cultural expressions. Today, Mijikenda communities are gradually abandoning the Kayas in favour of informal urban settlements. Due to pressure on land resources, urbanization and social transformations, the traditions and cultural practices associated to the Kaya settlements are fast diminishing, posing great danger to the social fabric and cohesiveness of the Mijikenda communities who venerate and celebrate them as their identity and symbol of continuity. ",N/A,N/A
Akiu no Taue Odori,Japan,"In the Akiu no Taue Odori, residents of the town of Akiu in northern Japan pray for a good harvest by simulating in dance the actions involved in transplanting rice. Performed since the end of the seventeenth century in communities throughout the region, the Akiu no Taue Odori today takes place during festivals in the spring or autumn. Ten female dancers dressed in colourful kimonos and floral headdresses, assisted by two to four male dancers, perform a repertoire of six to ten dances. Holding fans or bells, the women align themselves in one or two rows and perform movements designed to evoke the gestures of the rice cycle, particularly taue, the transplantation of seedlings into a large rice field filled with water. Once believed to ensure an abundant crop, the performances have lost their religious significance as attitudes and beliefs have changed, and as modern agricultural techniques have replaced rituals such as the Akiu no Taue Odori as guarantors of plenty. Today, the dance is a cultural and aesthetic event, connecting townspeople to their agricultural heritage, to Japan’s tradition of reliance on rice, and to a group identity transmitted across centuries through folk performance. ",N/A,N/A
Annual carnival bell ringers’ pageant from the Kastav area,Croatia,"During the January carnival period, bell ringers march through the villages that dot the Kastav region in north-west Croatia. Clothed in sheepskin throws with bells around their waists and sporting distinctive hats embellished with sprigs of evergreen, two to more than thirty ringers swagger in groups behind a guide carrying a small evergreen tree. They enliven their gait by bumping each others’ hips rhythmically and leaping into the air as they walk. Groups may also include theatrical characters such as a prankster ‘bear’ who regularly escapes the control of his two ‘guards’. When they reach a village, the bell ringers form concentric circles in the town square, ringing fiercely until the residents offer them food and a chance to rest before they continue their journey. At the end of the carnival, the ringers proceed through their own village, collecting rubbish at each house and burning it out front, involving everyone present in the ceremony. With variations distinctive to each village, the annual carnival bell ringers’ pageant is a way to strengthen bonds within the community and a valuable means of renewing friendships among the towns in the region while integrating newcomers into its traditional culture.",N/A,N/A
Art of Azerbaijani Ashiq,Azerbaijan,"The art of Azerbaijani Ashiqs combines poetry, storytelling, dance and vocal and instrumental music into a traditional performance art that stands as a symbol of Azerbaijani culture. Characterized by the accompaniment of the saz, a stringed musical instrument, the classical repertoire includes 200 songs, 150 literary-musical compositions known as dastans, nearly 2,000 poems in different traditional poetic forms and numerous stories. The regional variations may include other musical instruments, but all are united by a common national language and artistic history. Ashiqs take part in weddings, friendly parties and festive events throughout the Caucasus and appear on concert stages, radio and television, sometimes synthesizing classical melodies with contemporary ones as they continue to recreate their repertoire. Their art is considered an emblem of national identity and the guardian of Azerbaijani language, literature and music. Even as Ashiqs represent the consciousness of a people, they also help to promote cultural exchange and dialogue: Kurds, Lezhins, Talishes, Tats and other ethnic groups living in the country often perform the Ashiqs’ art, and their poems and songs have spread across the region.",N/A,N/A
Art of Chinese seal engraving,China,"The art of seal engraving is a cornerstone of Chinese fine arts. The seal was originally used as a signature or sign of authority, but it came to be used by all social classes and in much of Asia. The Seal Engravers’ Society of Xiling in Zhejiang Province, central China, which was founded a century ago, preserves the art of seal engraving along with approximately a hundred other specialized institutions. The design is first sketched on paper, and then engraved on stone, in reverse, with a knife. In addition to mastery of traditional calligraphy, the art of engraving requires a high degree of virtuosity, since the artist works on a tiny surface area where every curve, every thickness of line counts. The very diverse motifs are the fruit of the artist’s imagination and culture. As an instrument of calligraphy and painting, the seal is a work of art in itself. It expresses an entire culture’s ideas about humankind and nature. Today, seals continue to be used in official documents and private correspondence. Even though those understanding the complex characters are ever fewer, the art of seal engraving is still practised by both professionals and amateurs.",N/A,N/A
Âşıklık (minstrelsy) tradition,Turkey,"The Âşıklık (minstrelsy) tradition of Turkey is performed by wandering poet-singers known as âşıks. Dressed in traditional clothes and plucking a stringed saz, the âşık is a common performer at weddings, in coffeehouses and during public festivals of all sorts. The âşık is called in a dream to undertake a long apprenticeship in the arts of playing string and percussion instruments, singing, storytelling and repartee that form the heart of the vocation. The poems they recite, usually about love, are written in rhymed syllabic meter and end with a quatrain in which the âşık utters the Mâhlas, his pseudonym. Their improvisational performances may also include riddles, folk tales, verbal duels of wit and creativity with other âşıks, and verses sung while the minstrel holds a needle in his mouth to force him to recite poems avoiding B, P, V, M and F sounds. Because âşıks travel between communities, they help to spread cultural values and ideas and to facilitate a robust social dialogue, in part through topical poetry and social and political satire. At weddings in particular, âşıks are regarded as instructors and guides whose tradition draws on and enriches Turkish literary culture and the daily lives of communities throughout the country.",N/A,N/A
Aubusson tapestry,France,"A centuries-old tradition, the craft of Aubusson tapestry consists of weaving an image using processes practised in Aubusson and a number of other localities in the Creuse region of France. This craft produces mainly large decorative wall hangings but also rugs and pieces of furniture. Aubusson tapestry can be based on an image in any artistic style, prepared by a paper ‘cartoon’ (template) designer. Weaving is done manually by a lissier, or weaver, on a loom positioned horizontally, working on the reverse side of the tapestry, and using yarns that are hand-dyed in house. This process is time-consuming and expensive. The Aubusson tapestries are a gold standard throughout the world, to the extent that Aubusson has become a common noun in some languages. The production of tapestries in Aubusson and Felletin provides enough work for three small businesses and ten or so freelance artisan weavers, thus creating a significant volume of related work (wool production and spinning, marketing, by-products, museum, exhibitions and tourism). To stabilize the level of activity and avoid breaking the line of transmission, the interest of the young must be stimulated and this heritage promoted.",N/A,N/A
Busó festivities at Mohács: masked end-of-winter carnival custom,Hungary,"The Busó festivities at Mohács in southern Hungary are a six-day carnival in late February to mark the end of winter, named for the busós, frightening-looking costumed people (traditionally men) wearing wooden masks and big woolly cloaks. The festival is multifaceted, including a children’s costume contest, a display of the art of mask carvers and other craftspeople, the arrival of more than 500 busós in rowboats on the Danube for a march through the city alongside horse-drawn or motorized fantasy vehicles, the burning of a coffin symbolizing winter on a bonfire in the central square, and feasts and music throughout the city. The tradition originated with the Croatian minority in Mohács, but today the busó is a general emblem of the city and a commemoration of the great events of its history. More than a social event, the carnival is an expression of belonging to a city, a social group and a nation. It plays an important social role by offering a chance for self-expression in a communal setting. The arts underlying the festivities are preserved by self-organized groups of busós of all cultural backgrounds, many of whom pass on the techniques of mask carving and ritual celebration to younger generations.",N/A,N/A
Candombe and its socio-cultural space: a community practice,Uruguay,"Every Sunday and on many holidays, the llamadas de tambores de candombe or candombe drum calls enliven the Sur, Palermo and Cordón districts in southern Montevideo, Uruguay, home to a population of African descent. The practice of the candombe begins around communal fires as people gather to tune their drums and socialize before beginning their march. Once underway, the drum-call parade is led by the most prestigious members, from families recognized by the community for their drumming for many generations; other drummers are organized behind them in rows, and informal participants, dancers and spectators march alongside or watch from balconies. The beat of the largest and deepest drum, the piano, is distinctive to each of the three neighbourhoods, so that the organized call and response structure of the candombe both unites the districts and signals their individual identities. Transmitted within families of African descent, the candombe is recognized as an expression of resistance as well as a Uruguayan musical celebration and collective social practice deeply interwoven in the daily life of these neighbourhoods. It is also a symbol and manifestation of the memory of the community, drawing former residents back on special days to the historical nucleus of candombe.",N/A,N/A
Carnaval de Negros y Blancos,Colombia,"Arising out of native Andean and Hispanic traditions, the Carnaval de negros y blancos (Black and White Carnival) in San Juan de Pasto in south-western Colombia is a great celebration lasting from 28 December to 6 January each year. The celebrations begin on the 28th with the Carnival of Water − the throwing of water in homes and on the streets to initiate a festive mood. On New Year’s Eve, the Old Year’s parade takes place, with marchers carrying satirical figures representing celebrities and current events, and culminating in a ritual burning of the passing year. The main days of the carnival are the last two, when people of all ethnicities don black cosmetics on the first day, then white talcum on the next to symbolize equality and integrate all citizens through a celebration of ethnic and cultural difference. The Black and White Carnival is a period of intense communion, when private homes become collective workshops for the display and transmission of carnival arts and a wide range of people come together to express their views of life. The festival is especially important as the expression of a mutual desire for a future of tolerance and respect.",N/A,N/A
Chakkirako,Japan,"Located on a peninsula in Kanagawa Prefecture in central Japan, Miura City developed as a military port on the Pacific and a harbour providing shelter to passing ships. Drawing on dances from other cities demonstrated to them by visiting sailors, the people of Miura began the tradition of Chakkirako to celebrate the New Year and bring fortune and a bountiful catch of fish in the months to come. By the mid-eighteenth century, the ceremony had taken its form as a showcase for the talent of local girls. Every year in the middle of January, at a shrine or before the houses of the community, five to ten women from age forty to eighty sing a capella to accompany the dancing of ten to twenty young girls in colourful kimonos. The dancers perform face-to-face in two lines or in a circle, holding fans before their faces in some pieces and clapping thin bamboo sticks together in others. The name of the dance, Chakkirako, evokes the sound these sticks make. Transmitted from older women to young girls, Chakkirako employs a medley of centuries-old songs and dances to entertain and reaffirm the continuing cultural identity of the performers and their community.",N/A,N/A
