practice,country,summary,img,audio
"Sankirtana, ritual singing, drumming and dancing of Manipur",India,"Sankirtana encompasses an array of arts performed to mark religious occasions and various stages in the life of the Vaishnava people of the Manipur plains. Sankirtana practices centre on the temple, where performers narrate the lives and deeds of Krishna through song and dance. In a typical performance, two drummers and about ten singer-dancers perform in a hall or domestic courtyard encircled by seated devotees. The dignity and flow of aesthetic and religious energy is unparalleled, moving audience members to tears and frequently to prostrate themselves before the performers. Sankirtana has two main social functions: it brings people together on festive occasions throughout the year, acting as a cohesive force within Manipur’s Vaishnava community; and it establishes and reinforces relationships between the individual and the community through life-cycle ceremonies. It is thus regarded as the visible manifestation of God. The Sankirtana of Manipur is a vibrant practice promoting an organic relationship with people: the whole society is involved in its safeguarding, with the specific knowledge and skills traditionally transmitted from mentor to disciple. Sankirtana works in harmony with the natural world, whose presence is acknowledged through its many rituals.",N/A,N/A
Shrimp fishing on horseback in Oostduinkerke,Belgium,"Twelve households in Oostduinkerke are actively engaged in shrimp fishing: each has its own speciality, such as weaving nets or an extensive knowledge of Brabant draft horses. Twice a week, except in winter months, the strong Brabant horses walk breast-deep in the surf in Oostduinkerke, parallel to the coastline, pulling funnel-shaped nets held open by two wooden boards. A chain dragged over the sand creates vibrations, causing the shrimp to jump into the net. Shrimpers place the catch (which is later cooked and eaten) in baskets hanging at the horses’ sides. A good knowledge of the sea and the sand strip, coupled with a high level of trust and respect for one’s horse, are the shrimpers’ essential attributes. The tradition gives the community a strong sense of collective identity and plays a central role in social and cultural events, including the two-day Shrimp Festival for which the local community spends months building floats, preparing street theatre and making costumes. The shrimp parade, and a contest involving hundreds of children being initiated into shrimp catching, attract over 10,000 visitors every year. The shrimp fishers function on principles of shared cultural values and mutual dependence. Experienced shrimpers demonstrate techniques and share their knowledge of nets, tides and currents with beginners.",N/A,N/A
Traditional art of Jamdani weaving,Bangladesh,"Jamdani is a vividly patterned, sheer cotton fabric, traditionally woven on a handloom by craftspeople and apprentices around Dhaka. Jamdani textiles combine intricacy of design with muted or vibrant colours, and the finished garments are highly breathable. Jamdani is a time-consuming and labour-intensive form of weaving because of the richness of its motifs, which are created directly on the loom using the discontinuous weft technique. Weaving is thriving today due to the fabric’s popularity for making saris, the principal dress of Bengali women at home and abroad. The Jamdani sari is a symbol of identity, dignity and self-recognition and provides wearers with a sense of cultural identity and social cohesion. The weavers develop an occupational identity and take great pride in their heritage; they enjoy social recognition and are highly respected for their skills. A few master weavers are recognized as bearers of the traditional Jamdani motifs and weaving techniques, and transmit the knowledge and skills to disciples. However, Jamdani weaving is principally transmitted by parents to children in home workshops. Weavers – together with spinners, dyers, loom-dressers and practitioners of a number of other supporting crafts – form a closely knit community with a strong sense of unity, identity and continuity.",N/A,N/A
Traditional craftsmanship of the Mongol Ger and its associated customs,Mongolia,"Craftsmanship of the Mongol Ger is a traditional enterprise involving the labour of a household or group, with men carving the wood and both women and men engaged in painting, sewing and stitching, and felt-making. The Ger is a round structure of walls, poles and a peaked roof covered with canvas and felt, and tightened with ropes. It is light enough for nomads to carry; flexible enough to fold and pack; and sturdy enough to be dismantled and reassembled. The Ger can withstand Mongolia’s fierce spring winds. The structure is the same across the country: a wooden frame painted and decorated with traditional ornamentation, covers made of white felt and canvas, ropes of animal hair, flooring and carpets of hand-sewn felt, and furniture. Traditional craftsmanship is taught to the younger generations, principally through mentoring by a senior craftsperson. Dismantling and reassembling the Ger are always family operations, with children learning by watching their elders. Cutting and preparing sheep’s wool, making felt, stitching canvas and preparing woodwork are usually communal endeavours. As a traditional dwelling, the Mongol Ger plays an important social and cultural role for nomadic families and its makers are highly respected.",N/A,N/A
Turkish coffee culture and tradition,Turkey,"Turkish coffee combines special preparation and brewing techniques with a rich communal traditional culture. The freshly roasted beans are ground to a fine powder; then the ground coffee, cold water and sugar are added to a coffee pot and brewed slowly on a stove to produce the desired foam. The beverage is served in small cups, accompanied by a glass of water, and is mainly drunk in coffee-houses where people meet to converse, share news and read books. The tradition itself is a symbol of hospitality, friendship, refinement and entertainment that permeates all walks of life. An invitation for coffee among friends provides an opportunity for intimate talk and the sharing of daily concerns. Turkish coffee also plays an important role on social occasions such as engagement ceremonies and holidays; its knowledge and rituals are transmitted informally by family members through observation and participation. The grounds left in the empty cup are often used to tell a person’s fortune. Turkish coffee is regarded as part of Turkish cultural heritage: it is celebrated in literature and songs, and is an indispensable part of ceremonial occasions.",N/A,N/A
"Washoku, traditional dietary cultures of the Japanese, notably for the celebration of New Year",Japan,"Washoku is a social practice based on a set of skills, knowledge, practice and traditions related to the production, processing, preparation and consumption of food. It is associated with an essential spirit of respect for nature that is closely related to the sustainable use of natural resources. The basic knowledge and the social and cultural characteristics associated with Washoku are typically seen during New Year celebrations. The Japanese make various preparations to welcome the deities of the incoming year, pounding rice cakes and preparing special meals and beautifully decorated dishes using fresh ingredients, each of which has a symbolic meaning. These dishes are served on special tableware and shared by family members or collectively among communities. The practice favours the consumption of various natural, locally sourced ingredients such as rice, fish, vegetables and edible wild plants. The basic knowledge and skills related to Washoku, such as the proper seasoning of home cooking, are passed down in the home at shared mealtimes. Grassroots groups, schoolteachers and cooking instructors also play a role in transmitting the knowledge and skills by means of formal and non-formal education or through practice.",N/A,N/A
"Xooy, a divination ceremony among the Serer of Senegal ",Senegal,"The Xooy divination ceremony is organized in village squares among the Serer community in west-central Senegal prior to the rainy season. During this long nocturnal gathering, master seers known as Saltigues each in turn step into a designated circle, where they deliver predictions before a rapturous audience accompanied by the rhythm of drums. The Xooy ceremony provides answers to key issues for the community such as the rains, plagues or illnesses, and remedies. The combination of the Saltigues’ vibrant clothing, songs and dances, proverbs and riddles creates a colourful ceremony, high on drama, as these officiating priests – masters of the art of communication – hold the audience in suspense until daybreak. The Xooy is a major event in the national cultural calendar and constitutes a privileged forum for the expression and presentation of Serer cultural heritage. The Saltigues are the living mediums of the Xooy and preserve and transmit the esoteric knowledge that is vital to the ceremony. They are also in charge of interceding between people, the Supreme Being, nature and genies, regulating society, and ensuring harmony between men, women and their environment. With their knowledge of plants, they also provide traditional therapies to alleviate suffering.",N/A,N/A
Methodology for inventorying intangible cultural heritage in biosphere reserves: the experience of Montseny,Spain,"Initiated by the UNESCO Centre in Catalonia, a non-governmental organization, the project focuses on the identification of intangible cultural heritage in a biosphere reserve and the drawing up of inventories. The project was undertaken in an area covering the Montseny Biosphere Reserve and National Park in the Autonomous Community of Catalonia, in cooperation with local stakeholders and institutions working in the fields of ethnology and traditional and popular Catalan culture. Its main objectives and outcomes were threefold: to design a methodology for preparing inventories; to draw up an inventory; and to prepare a document on the contributions of intangible cultural heritage to sustainable development. Through its participation plan and fieldwork, the project has also encouraged the involvement of the local population in identifying its intangible cultural heritage. The methodology developed for this project could be reproduced at the regional and international levels, and is suitable for developing countries. The observations on the contributions of intangible cultural heritage to sustainable development could also be useful for countries that have a rich natural and intangible heritage and are seeking ways to improve the conditions of their populations, without jeopardizing the opportunities for future generations.",N/A,N/A
"Ala-kiyiz and Shyrdak, art of Kyrgyz traditional felt carpets",Kyrgyzstan,"Traditional felt carpets are one of the foremost arts of the Kyrgyz people and an integral part of their cultural heritage. The Kyrgyz traditionally produce two types of felt carpets: Ala-kiyiz and Shyrdaks. Knowledge, skills, diversity, the semantics of ornamentation, and the ceremonies of creating carpets are all important cultural components, providing Kyrgyz people with a sense of identity and continuity. The making of Kyrgyz felt carpets is inseparably linked to the everyday life of nomads, who used felt carpets to warm and decorate their homes. Creation of felt carpets demands unity among the community and fosters the transmission of traditional knowledge – as a rule by older women who are normally concentrated in rural and mountainous areas, to younger women within the family. The Ala-kiyiz and Shyrdak traditional art is in danger of disappearing, however. The number of practitioners is diminishing, with most over forty years of age. The lack of governmental safeguarding, the disinterest of the younger generation, the dominance of inexpensive synthetic carpets, and the poor quality and low availability of raw materials are exacerbating the situation. As a result, Ala-kiyiz carpets have practically disappeared from Kyrgyz homes and Shyrdaks are under serious threat of being lost.",N/A,N/A
"Bigwala, gourd trumpet music and dance of the Busoga Kingdom in Uganda",Uganda,"Bigwala music and dance is a cultural practice of the Basoga people of Uganda, performed during royal celebrations such as coronations and funerals and, in recent decades, on social occasions. Bigwala describes a set of five or more monotone gourd trumpets blown in hocket to produce a melody, accompanied by a specific dance. A typical performance begins with one trumpet; other trumpets then join in followed by drummers, singers and dancers in that order. The singers and dancers move in a circular formation around the five drummers, swaying their waists gently and raising their hands with excitement in time with the music and rhythms. Women spectators ululate as the performance nears its climax. Bigwala plays a significant role in contributing to unity among the Basoga people. The lyrics of the songs narrate the history of the Basoga, focusing in particular on their king, thus symbolically reconfirming their identity and links with their past. Bigwala also addresses issues such as leadership, marriage problems and acceptable social norms and practices. At present, however, there are only four remaining older master bearers with skills in Bigwala making, playing and dancing, and their recent transmission attempts have been frustrated by financial obstacles. As a result, Bigwala is performed infrequently, which poses a real threat to its survival.",N/A,N/A
Earthenware pottery-making skills in Botswana’s Kgatleng District,Botswana,"Earthenware pottery-making skills are practised among the Bakgatla ba Kgafela community in south-eastern Botswana. The women potters use clay soil, weathered sandstone, iron oxide, cow dung, water, wood and grass to make pots of different forms, designs and styles that relate to the traditional practices and beliefs of the community. Pots are used for storing beer, fermenting sorghum meal, fetching water, cooking, ancestral worship and traditional healing rituals. When collecting the soils, the master potter communicates with the ancestors through meditation so that she will be guided to the ideal spot. After collection the weathered sandstone and clay soil are pounded using a mortar and pestle, then sieved and the resulting powders mixed with water to form the clay body. The pots are slab-built, fashioned by hand into round, conical or oval shapes starting from the base and ending with the rim, and smoothed with a wooden paddle. Once decorated, the pots are fired in a pit kiln. Earthenware skills are transmitted to daughters and granddaughters through observation and practice. However, the practice is at risk of extinction because of the decreasing number of master potters, low prices for finished goods and the increasing use of mass-produced containers. ",N/A,N/A
"Noken multifunctional knotted or woven bag, handcraft of the people of Papua",Indonesia,"Noken is a knotted net or woven bag handmade from wood fibre or leaves by communities in Papua and West Papua Provinces of Indonesia. Men and women use it for carrying plantation produce, catch from the sea or lake, firewood, babies or small animals as well as for shopping and for storing things in the home. Noken may also be worn, often for traditional festivities, or given as peace offerings. The method of making Noken varies between communities, but in general, branches, stems or bark of certain small trees or shrubs are cut, heated over a fire and soaked in water. The remaining wood fibre is dried then spun to make a strong thread or string, which is sometimes coloured using natural dyes. This string is knotted by hand to make net bags of various patterns and sizes. The process requires great manual skill, care and artistic sense, and takes several months to master. The number of people making and using Noken is diminishing, however. Factors threatening its survival include lack of awareness, weakening of traditional transmission, decreasing numbers of craftspeople, competition from factory-made bags, problems in easily and quickly obtaining traditional raw materials, and shifts in the cultural values of Noken. ",N/A,N/A
"Al ‘azi, elegy, processional march and poetry",Oman,"Al ‘azi is a genre of sung poetry performed in the northern regions of the Sultanate of Oman. It constitutes one of the major expressions of Omani cultural and musical identity. It takes the form of a poetry contest punctuated by sword and step movements and poetic exchanges between a singer poet and a choir. It may involve a large number of participants from one village or tribe, guided by the poet who recites improvised and memorized poems in Arabic. The performers must pay attention to his movements and recitation, and respond with appropriate replies and movements. The poems express pride of belonging and may eulogize the tribe, important people or historical moments. Al ‘azi enriches the cultural and intellectual side of the community through creative reinvention of existing poems, and plays a great role in conserving society’s oral memory. It also promotes unity and communication and emphasizes the need to overcome disagreements between members of society. Al ‘azi is performed at all national and social occasions as an emblem of social pride, strength and unity. At present it is practised by over a hundred ensembles.",N/A,N/A
"Al-Taghrooda, traditional Bedouin chanted poetry in the United Arab Emirates and the Sultanate of Oman",United Arab Emirates and Oman,"Al-Taghrooda traditional Bedouin chanted poetry is composed and recited by men travelling on camelback through desert areas of the United Arab Emirates and the Sultanate of Oman. Bedouins believe that chanting entertains the riders and stimulates animals to walk in time. Short poems of seven lines or less are improvised and repeated between two groups of riders often as antiphonal singing. Generally the lead singer chants the first verse and the second group responds. Poems are also chanted around campfires, at weddings, and at tribal and national festivities, particularly camel races, and some Bedouin women compose and chant while engaged in collective work. The most important aspect is the social bonding during the oral exchange of verses. Themes include sending messages to loved ones, relatives, friends or tribal chiefs. It is also a medium for the poet to pass comment on social issues. Other functions include settlement of disputes among individuals or tribes, highlighting historical achievements, and contemporary themes such as good driving practice and health issues. Performances also provide a chance for audiences to learn about their past history and have a glimpse of their traditional way of life. The ability to compose and chant poems is transmitted through the family and by community elders.",N/A,N/A
"Arirang, lyrical folk song in the Republic of Korea",Republic of Korea,"Arirang is a popular form of Korean folk song and the outcome of collective contributions made by ordinary Koreans throughout generations. Essentially a simple song, it consists of the refrain ‘Arirang, arirang, arariyo’ and two simple lines, which differ from region to region. While dealing with diverse universal themes, the simple musical and literary composition invites improvisation, imitation and singing in unison, encouraging its acceptance by different musical genres. Experts estimate the total number of folk songs carrying the title ‘Arirang’ at some 3,600 variations belonging to about sixty versions. A great virtue of Arirang is its respect for human creativity, freedom of expression and empathy. Everyone can create new lyrics, adding to the song’s regional, historical and genre variations, and cultural diversity. Arirang is universally sung and enjoyed by the Korean nation. At the same time, an array of practitioners of regional versions, including local communities, private groups and individuals, actively lead efforts for its popularization and transmission, highlighting the general and local characteristics of individual versions. Arirang is also a popular subject and motif in diverse arts and media, including cinema, musicals, drama, dance and literature. It is an evocative hymn with the power to enhance communication and unity among the Korean people, whether at home or abroad.",N/A,N/A
"Buddhist chanting of Ladakh: recitation of sacred Buddhist texts in the trans-Himalayan Ladakh region, Jammu and Kashmir, India",India,"In the monasteries and villages of the Ladakh region, Buddhist lamas (priests) chant sacred texts representing the spirit, philosophy and teachings of the Buddha. Two forms of Buddhism are practised in Ladakh – Mahayana and Vajrayana – and there are four major sects, namely Nyngma, Kagyud, Shakya and Geluk. Each sect has several forms of chanting, practised during life-cycle rituals and on important days in the Buddhist and agrarian calendars. Chanting is undertaken for the spiritual and moral well-being of the people, for purification and peace of mind, to appease the wrath of evil spirits or to invoke the blessing of various Buddhas, Bodhisattvas, deities and rinpoches. The chanting is performed in groups, either sitting indoors or accompanied by dance in monastery courtyards or private houses. The monks wear special costumes and make hand gestures (mudras) representing the divine Buddha, and instruments such as bells, drums, cymbals and trumpets lend musicality and rhythm to the chanting. Acolytes are trained under the rigorous supervision of senior monks, reciting texts frequently until they are memorized. Chants are practised everyday in the monastic assembly hall as a prayer to the deities for world peace, and for the personal growth of the practitioners.",N/A,N/A
Cherry festival in Sefrou,Morocco,"For three days in June each year, the local population of Sefrou celebrates the natural and cultural beauty of the region, symbolized by the cherry fruit and that year’s newly chosen Cherry Queen, selected during a pageant that draws competitors from the region and entire country. The highlight of the festival is a parade with performing troupes, rural and urban music, majorettes and bands, and floats featuring local producers. At the centre is the Cherry Queen, who offers cherries to onlookers while dressed ornately and surrounded by attendants. The whole population contributes to the success of the festival: craftswomen make silk buttons for traditional dresses, fruit growers supply cherries, local sports clubs participate in competitions, and music and dancing troupes animate the entire festival. The cherry festival provides an opportunity for the entire city to present its activities and achievements. The younger generation are also integrated into festival activities to ensure their sustainability. The festival is a source of pride and belonging that enhances the self-esteem of the city and its people and constitutes a fundamental contribution to their local identity.",N/A,N/A
"Craftsmanship and performance art of the Tar, a long-necked string musical instrument",Azerbaijan,"The Tar is a long-necked plucked lute, traditionally crafted and performed in communities throughout Azerbaijan. Considered by many to be the country’s leading musical instrument, it features alone or with other instruments in numerous traditional musical styles. Tar makers transmit their skills to apprentices, often within the family. Craftsmanship begins with careful selection of materials for the instrument: mulberry wood for the body, nut wood for the neck, and pear wood for the tuning pegs. Using various tools, crafters create a hollow body in the form of a figure eight, which is then covered with the thin pericardium of an ox. The fretted neck is affixed, metal strings are added and the body is inlaid with mother-of-pearl. Performers hold the instrument horizontally against the chest and pluck the strings with a plectrum, while using trills and a variety of techniques and strokes to add colour. Tar performance has an essential place in weddings and different social gatherings, festive events and public concerts. Players transmit their skills to young people within their community by word of mouth and demonstration, and at educational musical institutions. Craftsmanship and performance of the tar and the skills related to this tradition play a significant role in shaping the cultural identity of Azerbaijanis.",N/A,N/A
