practice,country,summary,img,audio
"Nawrouz, Novruz, Nowrouz, Nowrouz, Nawrouz, Nauryz, Nooruz, Nowruz, Navruz, Nevruz, Nowruz, Navruz","Afghanistan, Azerbaijan, India, Iran (Islamic Republic of), Iraq, Kazakhstan, Kyrgyzstan, Uzbekistan, Pakistan, Tajikistan, Turkmenistan and Turkey","New Year is often a time when people wish for prosperity and new beginnings. March 21 marks the start of the year in Afghanistan, Azerbaijan, India, Iran (Islamic Republic of), Iraq, Kazakhstan, Kyrgyzstan, Pakistan, Tajikistan, Turkey, Turkmenistan and Uzbekistan. It is referred to as Nauryz, Navruz, Nawrouz, Nevruz, Nooruz, Novruz, Nowrouz or Nowruz meaning ‘new day’ when a variety of rituals, ceremonies and other cultural events take place for a period of about two weeks. An important tradition practised during this time is the gathering around ‘the Table’, decorated with objects that symbolize purity, brightness, livelihood and wealth, to enjoy a special meal with loved ones. New clothes are worn and visits made to relatives, particularly the elderly and neighbours. Gifts are exchanged, especially for children, featuring objects made by artisans. There are also street performances of music and dance, public rituals involving water and fire, traditional sports and the making of handicrafts. These practices support cultural diversity and tolerance and contribute to building community solidarity and peace. They are transmitted from older to younger generations through observation and participation.",N/A,https://ich.unesco.org/doc/download.php?versionID=50782
"Oshi Palav, a traditional meal and its social and cultural contexts in Tajikistan",Tajikistan,"Oshi palav (pilaf) is a traditional dish of communities in Tajikistan recognized as a part of their cultural heritage. Otherwise known as the ‘King of meals’, it is based on a recipe using vegetables, rice, meat and spices but up to 200 varieties of the dish exist. Considered an inclusive practice that aims to bring people of different backgrounds together, oshi palav is prepared to be enjoyed at regular mealtimes, as well as social gatherings, celebrations and rituals. The importance of the dish to communities in Tajikistan is indicative in sayings such as “No Osh, no acquaintance” or “If you have eaten Osh from somebody, you must respect them for 40 years”. Groups of men or women prepare the dish either in their homes or at teahouses while socalizing or playing music and singing. Knowledge and skills associated with the practice is transmitted on an intergenerational basis in families, in addition to cooking schools from master to apprentice. Once an apprentice masters oshi palav, the apprentice hosts a dinner for the trainer and guests during which the trainer receives a skull-cap and traditional dress while the apprentice receives a skimmer (a tool for cooking oshi palav) symbolizing the apprentice’s independence.",N/A,https://ich.unesco.org/doc/download.php?versionID=50796
Palov culture and tradition,Uzbekistan,"There is a saying in Uzbekistan that guests can only leave their host’s house after palov has been offered. Palov is a traditional dish made and shared throughout rural and urban communities of Uzbekistan. It is prepared with ingredients such as rice, meat, spices and vegetables and in addition to be enjoyed as a regular meal, is served as a gesture of hospitality, to celebrate special occasions like weddings and new year, to help those in need who are underprivileged, or to honour loved ones who have passed away. Palov may also feature at events alongside other rituals taking place such as prayer and performances of traditional music. It is a dish that is cooked by men and women regardless of age or social status. Knowledge and skills associated with the practice are handed down from older to younger generations formally and informally using a master-apprentice model or by demonstration and participation within families, peer groups, community-based establishments, religious organizations and vocational educational institutions. The making and sharing of the traditional dish acts to strengthen social ties, promote values including solidarity and unity and assist in the continuity of local traditions that form a part of the community’s cultural identity.",N/A,https://ich.unesco.org/doc/download.php?versionID=50787
Practices related to the Viet beliefs in the Mother Goddesses of Three Realms,Viet Nam,"To meet spiritual needs, everyday wishes and gain help in achieving good health and success communities in Viet Nam worship the Mother Goddesses of Three Realms: heaven, water, and mountains and forests. The Mother Goddesses include Liễu Hạnh (a nymph who descended to earth, lived as a human and became a Buddhist nun) referred to as the Mother of the World, and other spirits considered legendary heroes. The traditional practice involves daily worship and participation in ceremonies, rituals like the spirit possession ritual and festivals such as Phủ Dầy that take place at temples dedicated to the Mother Goddesses. These activities associated with the practice help to maintain part of the community’s history, cultural heritage and identity with some aspects incorporating traditional costumes, music and dance. Bearers and practitioners are members of the public, temple guardians, ritual priests, spirit mediums, assistants and musicians who transmit knowledge and skills orally to newcomers and family members. The practice of shared values and strong beliefs in the compassion and grace of the Mother Goddesses provides a basis for social relations connecting members of participating communities. The worshipping of the Mother Goddesses also contributes to the appreciation of women and their roles in society.",N/A,https://ich.unesco.org/doc/download.php?versionID=50774
Puppetry in Slovakia and Czechia,Slovakia and Czechia,"Puppet theatre for communities in Slovakia and Czechia is not only a popular form of traditional entertainment but also a way of conveying a vision of the world, and an educational tool with messages on moral values. The puppets, whose characters are real or imaginary, are mostly made of wood and animated using various methods. Initial bearers of the practice were families of travelling puppeteers whose works later absorbed local influences in language and themes using namely comical figures with distinct characteristics. Puppet theatre is an integral part of Slovak and Czech local theatre and literary tradition. It also plays an important role in socialization, helping performers to develop as creative thinkers and learn about cooperation, communication and to strengthen their sense of identity in society. Featuring with other traditional rituals and festive events like feast days, markets and fairs, puppet shows today come in many different forms but still draw from tradition. Practice bearers include performers, playwrights, puppet and costume makers, as well as stage designers. Skills are transmitted by imitation and practice within performer communities, while in Slovakia also transmission takes place in traditional puppetry dynasties, as well as through workshops run by not-for-profit organizations and music and arts schools.",N/A,https://ich.unesco.org/doc/download.php?versionID=50802
"Rumba in Cuba, a festive combination of music and dances and all the practices associated",Cuba,"The music and movements of rumba in Cuba are mainly associated with African culture but also feature elements from Antillean culture and Spanish flamenco. Historically, rumba in Cuba developed in marginal neighbourhoods of cities in Cuba like Havana and Matanzas, near other ports and shanty towns and grew especially popular in rural areas where communities of African slaves lived. Spreading from the west to the east of the country, it has been a major symbol of a marginal layer of Cuban society and identity, acting as an expression of self-esteem and resistance and tool for social outreach, helping to enrich the lives of practising communities. Performances consist of verbal and non-verbal forms of communication such as chants, gestures, handclapping, dance and specific body language. Instruments, either percussion or simply utensils from the home or work, are part of the practice. A festive atmosphere develops where the performers, working within specific cultural codes, and the audience begin to interact. The dances and chants evoke a sense of grace, sensuality and joy that aims to connect people, regardless of their social and economic background, gender or ethnicity. The practice of rumba in Cuba has been transmitted over generations by imitation within families and neighbourhoods.",N/A,https://ich.unesco.org/doc/download.php?versionID=50793
Škofja Loka passion play,Slovenia,"In Škofja Loka, Slovenia, a folk play performed as a procession takes place in the streets of the town’s medieval centre during Lent and Easter involving more than 900 local performers. The Škofja Loka Passion Play, based on the ancient works of a Capuchin monk, demonstrates 20 scenes of the stations of the cross and others from the Old Testament and New Testament. Performed in the dialect of the time it was written, the play takes place at a series of locations. In addition to the actors, 400 other volunteers from the community participate in the play’s production. Due to the complexity involved, the Škofja Loka Passion Play is only performed every six years. While it is considered to be an important part of local identity, the play also contributes to social cohesion giving residents involved an opportunity to connnect with one other and feel like they are contributing to their community. Knowledge and skills associated with the practice of the play are transmitted from older to younger generations by families who participate, and craftspeople assisting in the play’s production who host classes passing on know-how to others. The Passion Play is also included in the curricula of local schools.",N/A,https://ich.unesco.org/doc/download.php?versionID=50803
"Tahteeb, stick game",Egypt,"In ancient Egypt, tahteeb was used as a form of martial arts. Its role has since changed to that of a festive game but some of the symbolism and values associated with the practice remain. Performed in front of an audience, it involves a brief, non-violent interchange between two adversaries, each wielding a long stick while folk music plays in the background. Complete control must be exercised as no striking is allowed. Practitioners are male both young and old, mostly from Saeedy populations in upper Egypt, particularly rural areas where the tahteeb stick has been used by inhabitants as part of their daily lives and considered a sign of manhood. The rules of the game are based on values such as mutual respect, friendship, courage, strength, chivalry and pride. Tahteeb is practised in public and private social settings. Sometimes competitions are held to encourage new players and special tahteeb evenings involving different governorates that can last almost a week. Transmission occurs within families, neighbourhoods and to anyone who wishes to learn. The game gives participants confidence from skills acquired and a sense of pride performing before their community. It also helps to strengthen family ties and foster good communal relations.",N/A,https://ich.unesco.org/doc/download.php?versionID=50795
"The Twenty-Four Solar Terms, knowledge in China of time and practices developed through observation of the sun’s annual motion",China,"The ancient Chinese divided the sun’s annual circular motion into 24 segments. Each segment was called a specific ‘Solar Term’. The element of Twenty-Four Solar Terms originated in the Yellow River reaches of China. The criteria for its formulation were developed through the observation of changes of seasons, astronomy and other natural phenomena in this region and has been progressively applied nationwide. It starts from the Beginning of Spring and ends with the Greater Cold, moving in cycles. The element has been transmitted from generation to generation and used traditionally as a timeframe to direct production and daily routines. It remains of particular importance to farmers for guiding their practices. Having been integrated into the Gregorian calendar, it is used widely by communities and shared by many ethnic groups in China. Some rituals and festivities in China are closely associated with the Solar Terms for example, the First Frost Festival of the Zhuang People and the Ritual for the Beginning of Spring in Jiuhua. The terms may also be referenced in nursery rhymes, ballads and proverbs. These various functions of the element have enhanced its viability as a form of intangible cultural heritage and sustain its contribution to the community’s cultural identity. Knowledge of the element is transmitted through formal and informal means of education.",N/A,https://ich.unesco.org/doc/download.php?versionID=50766
Traditional craftsmanship of Çini-making,Turkey,"Çini are traditional, handmade glazed tiles and ceramics made in Turkey featuring colourful motifs of plants, animals and geometric patterns often found on facades of buildings and in homes throughout the country. Producing çini involves a series of processes. The clay is first shaped, lined, dried and fired in ovens specifically for çini making. Designs representing local customs and beliefs are then drilled on paper and transferred to the surface with coal dust. Outer contours of the patterns are hand drawn, the surface dyed in various colours and then the work is glazed and fired. Çini-making workshops involve craftspeople, supervisors and apprentices. Each craftsperson has a specific role – shaping, design and dye, polishing and undercoating or firing. Practitioners consider çini making as an outlet for self-expression, development and healing, as well as a means of maintaining an art form that is a symbolic aspect of Turkey’s cultural identity, strengthening links from the past to the present providing continuity. Çini making is not confined to workshop spaces. The tradition is also practised in the home, public education centres, vocation schools and universities throughout the country where neither age, gender nor ethnicity are barriers to knowledge sharing, transmission and skills development.",N/A,https://ich.unesco.org/doc/download.php?versionID=50771
Traditional wall-carpet craftsmanship in Romania and the Republic of Moldova,Republic of Moldova and Romania,"In the past, wall carpets produced by weavers in communities of Romania and the Republic of Moldova were used not only as decorative features and sources of insulation but also as part of a bride’s dowry. A variety of techniques were needed to produce the pieces with impressive motifs. Certain patterns also indicated where the weaver was from. The carpets had additional roles in community practices, such as at funerals where they symbolized a passage for the soul to the hereafter. They were also displayed at international exhibitions as markers of national identity. These days, wall carpets are mainly appreciated as works of art for public and private spaces and exhibited at city festivals and ceremonies. Techniques have changed from vertical or horizontal looms practised in some parts, to tight picking (thread by thread) and other forms with weavers now able to work from home. In villages, girls learn the art form from their mother or grandmother, while in cities craft centers, associations and colleges, as well as museums provide classes. Viewed as an expression of creativity and identity marker, wall carpet craftsmanship is also considered as a tool to unite groups in society of different ages and socioeconomic backgrounds.",N/A,https://ich.unesco.org/doc/download.php?versionID=50788
Valencia Fallas festivity,Spain,"The main feature of the Fallas Festivity, a tradition of communities in Valencia and its diaspora celebrating the coming of spring, is the giant falla. The falla is a monument made up of ninots (caricature pieces) created by local artists and craftspeople that provides a commentary on current social issues. Erected in the town square, the falla is set alight at the end of the festivity, which runs from March 14 to 19, to symbolize the coming of spring, purification and a rejuvenation of community social activity. In the meantime, marching bands parade the streets, outdoor meals are held and fireworks staged. Each year, a Fallas Queen is elected to promote the festivity throughout the year encouraging locals and visitors to take part. Know-how associated with the practice is transmitted within families, particularly those involved in the construction of the ninots who belong to different guilds among participating communities. The Fallas Festivity provides an opportunity for collective creativity and the safeguarding of traditional arts and crafts. It is also a source of community pride, contributor to cultural identity and enhances social cohesion. In the past, the festivity was also a way of preserving the Valencian language when it was prohibited.",N/A,https://ich.unesco.org/doc/download.php?versionID=50767
Winegrowers’ Festival in Vevey,Switzerland,"In Vevey, Switzerland there is a tradition that recognizes the community’s winegrowers involving not only those in the industry but also members of the public and local artists. Originally a single pageant, The Winegrowers’ Festival now features 15 events over three weeks and 5,000 contributors. Every festival is based on the recreation of a traditional theme, such as working the earth and vines, seasonal cycle  and brotherhood. Pageants are held throughout the festival, as well as prizes awarded to the best winegrowers, music performances and songs sung such as the Ranz des Vaches (Alpine cow-herder’s song) and processions to the neighbouring town of La Tour-de-Peilz. Costumed extras can also be seen, as well as grotesques (wooden figurines on sticks). Taking place five times every hundred years, The Winegrowers’ Festival involves mainly volunteers who spend several years preparing for it. Transmission occurs within families and by the not-for-profit association the Vevey Brotherhood of Winegrowers, which coordinates the festival and whose members include winegrowers and the general public. The tradition encourages community spirit, helps to maintain the area’s artistic life and provides a sense of cultural continuity while facilitating the know-how of master winegrowers. The next festival will be in 2019.",N/A,https://ich.unesco.org/doc/download.php?versionID=50801
"Yama, Hoko, Yatai, float festivals in Japan",Japan,"In cities and towns throughout Japan, float festivals are held by communities annually to pray to the gods for peace and protection from natural disasters. The element of Yama, Hoko and Yatai float festivals encompasses 33 representative examples in various regions throughout Japan showcasing the diversity of local cultures. They involve the collaborative efforts of various sections of the community and as a traditional practice are an important aspect of the cultural identity of participants. Men, women, the young and elderly from cities and other parts of the area share responsibility for the organization and running of the festivals. This includes every step from the design and construction of the floats that reflect the diversity of local culture, to the accompanying music and overall event coordination. The Takaoka Mikurumayama Festival, for example, involves residents from the city centre assembling the floats while those from surrounding areas are in charge of pulling the constructs and playing the music. Tasks cater for specific ages with senior bearers providing guidance to those less experienced and classes run for young people. For instance, for the Ueno Tenjin Festival participants first learn how to play the music (they are referred to as hayashikata), they then progress to steering the floats (tekogata), guarding them (keigoyaku) and finally, managing the festival (saihaiyaku).",N/A,https://ich.unesco.org/doc/download.php?versionID=50773
Yoga,India,"The philosophy behind the ancient Indian practice of yoga has influenced various aspects of how society in India functions, whether it be in relation to areas such as health and medicine or education and the arts. Based on unifying the mind with the body and soul to allow for greater mental, spiritual and physical wellbeing, the values of yoga form a major part of the community’s ethos. Yoga consists of a series of poses, meditation, controlled breathing, word chanting and other techniques designed to help individuals build self-realization, ease any suffering they may be experiencing and allow for a state of liberation. It is practised by the young and old without discriminating against gender, class or religion and has also become popular in other parts of the world. Traditionally, yoga was transmitted using the Guru-Shishya model (master-pupil) with yoga gurus as the main custodians of associated knowledge and skills. Nowadays, yoga ashrams or hermitages provide enthusiasts with additional opportunities to learn about the traditional practice, as well as schools, universities, community centres and social media. Ancient manuscripts and scriptures are also used in the teaching and practice of yoga, and a vast range of modern literature on the subject available.",N/A,https://ich.unesco.org/doc/download.php?versionID=50784
Community project of safeguarding the living culture of Rovinj/Rovigno: the Batana Ecomuseum,Croatia,"A batana is a type of traditional fishing boat found in Rovinj, Croatia. Important to the town’s trade and heritage, with craftsmanship methods handed down by families, it became scarce with the popularity of industrial models until 2004 when local enthusiasts started an association to help safeguard it and its associated practices (an old dialect and traditional songs). The not-for-profit House of Batana, with the support of the municipality, the Heritage Museum of the City of Rovinj, Rovinj Historic Research Centre, the Italian Community of Rovinj and an eco-museology expert created the Batana Ecomuseum to raise public awareness and provide training on practices linked to the batana. It features a permanent exhibition showcasing how the batana is built and fishing equipment is made, as well as the variety of fishing activities conducted; runs workshops on constructing the boat, also available for shipbuilders; publishes expert material; hosts regattas encouraging involvement from young people; has a shipyard for building and repairing the boats that are now also used for guided tours; and cooperates on a national and international level, taking part in festivals, regattas and roundtable discussions to highlight the batana’s role in traditional vessel communities and to help safeguard maritime heritage.",N/A,https://ich.unesco.org/doc/download.php?versionID=50779
Festival of folklore in Koprivshtitsa: a system of practices for heritage presentation and transmission,Bulgaria,"The concept for the Festival of Folklore in Koprivshtitsa, where thousands of Bulgarians of all ages and the diaspora meet in August to present and share their intangible cultural heritage practices ranging from dance and storytelling, to games and craftsmanship, originated when local musicians saw a need to protect traditions endangered by factors such as urbanization and commodification. Hosted by the Koprivshtitsa municipality with assistance from the Ministry of Culture, Bulgarian National Television, Bulgarian National Radio, the Institute of Ethnology and Folklore Studies with the Ethnographic Museum, the Institute for Art Studies and community centres, the festival raises awareness about the importance of safeguarding living heritage and promotes its presence in people’s lives, documents it for future continuity and stimulates transmission. Performers are nominated through selection procedures organized by Bulgaria’s administrative districts where new traditions are also identified, then performances broadcasted and documented by scholars for archival records such as those at the Institute of Ethnology and Folklore Studies with the Ethnographic Museum. Since the first festival in 1965, nine editions have taken place with 18,000 performers participating in 2010, attracting visitors from throughout the country and abroad. Many festival performers go on to become known internationally.",N/A,https://ich.unesco.org/doc/download.php?versionID=50769
