practice,country,summary,img,audio
"Enkipaata, Eunoto and Olng'esherr, three male rites of passage of the Maasai community",Kenya,"Enkipaata, Eunoto and Olng’esherr are three interrelated male rites of passage of the Maasai community: Enkipaata is the induction of boys leading to initiation; Eunoto is the shaving of the morans paving the way to adulthood; and Olng’esherr is the meat-eating ceremony that marks the end of moranism and the beginning of eldership. The rites of passage are mainly practised by young men of the Maasai community aged between fifteen and thirty, but women also undertake certain tasks. By educating young people about their future role in Maasai society, the rites serve to induct them first to moranhood, then as young elders, and finally as senior elders. Respect and responsibility, safeguarding of the lineage, transfer of powers from one age set to the next and the transmission of indigenous knowledge, such as in relation to livestock rearing, conflict management, legends, traditions and life skills, are some of the core values embedded in those rites of passage. However, while the rites still attract relatively sizeable crowds, the practice appears to be rapidly declining due to the fast emergence of agriculture as a main source of income, reforms of the land tenure system and the impact of climate change that affects the survival of cattle.",N/A,https://ich.unesco.org/doc/download.php?versionID=50670
Knowledge and skills of the water measurers of the foggaras or water bailiffs of Touat and Tidikelt,Algeria,"The element concerns the knowledge and skills of the water measurers of the foggaras (system of channels), or water bailiffs, of the ksour (village) communities of Touat and Tidikelt. The water measurers are involved in various operations, from calculating water shares to repairing distribution combs and conducting water in the channel. Every foggara connects several categories of social agents and knowledge bearers, including owners, manual workers, accountants and water measurers, but it is the water measurers’ knowledge that appears to be under threat. The water measurers are a key figure in the life of the Saharan ksour because they manage a domain vital to the survival of all. They play both an intellectual and a manual role and can be called upon continuously by the community. However, there is currently a lack of communication between young people and their elders, and several factors have disrupted the proper functioning of the foggara, including changes by the central government to relations of ownership, the effects of urbanization and modernisation, and a lack of consideration as to what steps need to be taken to ensure knowledge is transmitted. The loss of activity for water measurers is directly reflected in their advanced age, which demonstrates a lack of new practitioners entering the business.",N/A,https://ich.unesco.org/doc/download.php?versionID=50658
Lkhon Khol Wat Svay Andet,Cambodia,"Lkhon Khol Wat Svay Andet is practised in one community surrounding a Buddhist monastery, Wat Svay Andet – located about 10km east of Phnom Penh on the Mekong River – and is performed by men wearing masks to the accompaniment of a traditional orchestra and melodious recitation. The specific aim is to propitiate the Neak Ta (guardian spirits of a place and its people), thereby protecting and bringing prosperity to the community, its lands and harvest. When Lkhon Khol is performed, spirit mediums are present and facilitate interactions between the Neak Ta, performers and villagers. When the spirits are satisfied with the performance, villagers are blessed by them; otherwise, the dancers stop, the music continues, and the audience falls silent and carefully listens to the spirits. Lkhon Khol is performed for ritual purposes, mostly linked to the cycle of rice farming and the needs of farming communities. The practice is transmitted orally within the community, and the Head Monk and retired primary school principal recently initiated additional weekend classes and started writing down scripts for selected episodes. After generations of transmission, however, several factors now threaten the viability of the element, including environmental factors, insufficient resources, economic migration from the community and a fourteen-year break in transmission from 1970 to 1984 due to the war and the Khmer Rouge regime.",N/A,https://ich.unesco.org/doc/download.php?versionID=50668
Shadow play,Syrian Arab Republic,"Shadow play is a traditional art consisting of handmade puppets moving behind a thin translucent curtain or screen inside a dark theatre, now practised mainly in Damascus. A light from behind the stage projects the shadows of the puppets onto the screen as they move along to an oral script and music. The theatrical content of Shadow play revolves around humorous social criticisms – employing elements of suggestion, poetry, prose, singing and music – and satire is employed to relay narratives between the two main characters, the naïve Karakoz and his clever friend Eiwaz. Other characters include female personalities and talking animals. Performances are traditionally held in popular cafes, where people gather to watch stories about everyday life. The prevalence of Shadow play has declined over the years, however, notably due to the spread of modern technology and digital forms of entertainment, and the mass displacement of Syrian people both inside and outside the country as a result of armed conflicts in Syria. Performances in popular cafes have waned and are now mostly confined to festivals, special holidays and theatres. The confluence of these factors has negatively affected the sustainability of the element, to the point that there is only one active Mukhayel (puppeteer) left in Damascus.",N/A,https://ich.unesco.org/doc/download.php?versionID=50672
"Suri Jagek (observing the sun), traditional meteorological and astronomical practice based on the observation of the sun, moon and stars in reference to the local topography",Pakistan,"Suri Jagek, literally translated as ‘observing the sun’, is the traditional Kalasha meteorological and astronomical knowledge system and practice – enacted predominantly in the Hindu Kush mountain range – based on the observation of the sun, moon, stars and shadows with respect to the local topography. The system is a complex structure of empirically observed knowledge and is repeatedly referenced to allow the Kalasha people to predict the appropriate time for sowing seeds, animal husbandry and natural calamities. It is also used to govern the Kalasha calendar by determining the dates of important social events, festivals, feasts and religious ceremonies. The practice demonstrates the relationship of the Kalasha people with their surroundings and the importance of their immediate geographical context to sustain their way of life. The viability and transmission of the knowledge system rest on an innovative transfer of information through folk stories, songs, proverbs and rhetoric and certain aspects of it – such as the study of shadows and its use in rearing cattle and livestock – are being recreated to fit into modern society. However, with the advent of the digital age, people are increasingly opting for more technologically ‘advanced’ means of predicting weather conditions. While the practice remains visible as an oral tradition, there is currently a lack of awareness among the younger generation about its cultural significance and benefits.",N/A,https://ich.unesco.org/doc/download.php?versionID=50671
Traditional hand puppetry,Egypt,"Al-Aragoz is an old form of Egyptian theatre using traditional hand puppetry. Performances are highly popular events during which puppeteers remain hidden inside a small portable stage while an assistant interacts with the puppets and crowd. Al-Aragoz takes its name from the main puppet, whose distinctive voice is created with a voice modifier. Performers and the audience interact dynamically throughout the shows, which have a comic and entertaining atmosphere, and practitioners must be skilled in manipulating and maintaining the puppet, as well as in improvisation and music. Shows explore a variety of themes relating to daily life, with a recurring theme being the struggle against corruption. The art used to be presented by groups of travelling performers, who moved from one folk celebration to another. However, when these performances began to dwindle, performers and their assistants settled permanently in fixed places, mostly in Cairo. The viability of the practice is threatened by the changing social, political, legal and cultural circumstances of its enactment, such as laws concerning public gatherings, the rise of religious radicalism, an overall decrease in interest among younger generations, and the advanced age of its active practitioners. The number of surviving practitioners has diminished while many of those who once-performed stories have now disappeared. ",N/A,https://ich.unesco.org/doc/download.php?versionID=50669
"Yalli (Kochari, Tenzere), traditional group dances of Nakhchivan",Azerbaijan,"Yalli, traditional group dances, are dance expressions based exclusively on collective performances. Typically, yalli are performed in a circle, chain or line, and involve elements of games, pantomime (bird or other animal imitations), physical exercises and movements. The community of the yalli dances consists of practising dancers, who enact the dances either spontaneously or in a planned manner at various festivities and celebrations. Some variants of yalli bear a song-like character and are practised by both women and men, while others are practised by men only and imitate pastoralist games with some elements of butting animals. Until the mid-twentieth century, yalli were widely practised but several factors have impacted the transmission of the practice thereafter. They include a gradual loss of social functions for certain types of yalli, a preference for staged performances, external factors such as labour migration and the economic crises of the late 1980s and early 1990s, a shift from informal to formal transmission, and a drastic simplification of the dances, which has entailed a loss of diversity.",N/A,https://ich.unesco.org/doc/download.php?versionID=50667
"Art of dry stone walling, knowledge and techniques","Croatia, Cyprus, France, Greece, Italy, Slovenia, Spain and Switzerland","The art of dry stone walling concerns the knowhow related to making stone constructions by stacking stones upon each other, without using any other materials except sometimes dry soil. Dry stone structures are spread across most rural areas – mainly in steep terrains – both inside and outside inhabited spaces, though they are not unknown in urban areas. The stability of the structures is ensured through the careful selection and placement of the stones, and dry-stone structures have shaped numerous, diverse landscapes, forming various modes of dwelling, farming and husbandry. Such structures testify to the methods and practices used by people from prehistory to today to organize their living and working space by optimizing local natural and human resources. They play a vital role in preventing landslides, floods and avalanches, and in combating erosion and desertification of the land, enhancing biodiversity and creating adequate microclimatic conditions for agriculture. The bearers and practitioners include the rural communities where the element is deeply rooted, as well as professionals in the construction business. Dry stone structures are always made in perfect harmony with the environment and the technique exemplifies a harmonious relationship between human beings and nature. The practice is passed down primarily through practical application adapted to the particular conditions of each place.",N/A,https://ich.unesco.org/doc/download.php?versionID=50681
As-Samer in Jordan,Jordan,"Practised across many areas of Jordan, As-Samer consists mainly of dancing and singing and is performed on various occasions, most commonly during marriage ceremonies. Practitioners range from young to older individuals, with children being encouraged to take part during performances. On the wedding day, the father of the groom instructs the attendees to line up and start applauding and singing. The performance that follows involves specific roles for certain people. The Al-Hashi is a veiled woman, always one of the inviters’ relatives, who sings and dances in front of the Al-Samer row while wearing an Abaya (a loose, black garment worn over the traditional garment). Another person is the ‘Wasq Al-Hashi’, one of the Al-Hashi’s relatives, who takes hold of her sleeve or Abaya and asks her to sit down. Then comes the role of the Al-Badda, a man who starts singing by directly addressing Al-Hashi, to resume the dancing with poetry. The lines of poetry uttered during the performance form an integral part of the tradition, expressing feelings of joy, peace, intimacy and empathy among attendees. Practising As-Samer consolidates social bonds and promotes cohesion, and attendees of all ages are encouraged to participate spontaneously, in an effort to transmit the related skills and knowledge to the next generations.",N/A,https://ich.unesco.org/doc/download.php?versionID=50690
Avalanche risk management,Switzerland and Austria,"Avalanche risk management has shaped the identity of Alpine populations, as every winter they deal with the threat avalanches pose to inhabitants, tourists, means of communication and other vital infrastructure. Since the Alps are densely populated, the phenomenon of avalanches is a prime concern and a collective responsibility of the communities. For centuries, inhabitants and highlanders have developed local empirical knowledge, management and risk-avoidance strategies as well as cultural practices to guard themselves against avalanche hazards. Nowadays, modern tools such as measurement instruments and risk mapping complement traditional knowledge, which continues to be developed and adjusted on the ground by knowledge bearers. The element is entrenched in the everyday culture of the communities concerned and underscores the importance of solidarity in crisis situations. Assessing avalanche risks requires a sound knowledge of nature, especially the terrain, snow, weather conditions and past avalanches. While that knowledge was once transmitted verbally, nowadays it is the result of a dynamic process combining empirical knowledge and practical experience: knowledge is transferred from science to practice, and from the ground to research. Numerous training activities are offered, and those interested have access to a wide range of information sources such as avalanche bulletins, the media, checklists, websites, media, manuals and exhibitions.",N/A,https://ich.unesco.org/doc/download.php?versionID=50712
"Blaudruck/Modrotisk/Kékfestés/Modrotlač, resist block printing and indigo dyeing in Europe","Austria, Czechia, Germany, Hungary and Slovakia","Blaudruck/Modrotisk/Kékfestés/Modrotlač, which translates directly as blueprint or blue-dyeing, refers to the practice of printing a dye-resistant paste onto a cloth before dyeing over it with indigo dye. The resistant paste prevents the dye from penetrating the design, thereby ensuring the applied design remains white or undyed after the dyeing process. To apply the designs onto the cloth, practitioners use hand-crafted blocks that are up to 300 years old, featuring regionally-inspired patterns as well as generic designs or Christian motifs. The representation of local flora and fauna is interrelated with the local culture of the regions. Traditional indigo blue-dyeing does not end with printing, however: the textile chain involves preparing the raw materials and spinning, weaving, finishing, printing and dyeing them. Nowadays, businesses engaged in the practice mainly comprise small, family-owned workshops, run by the second to seventh generation of printers. Each family workshop involves the cooperation of the various family members, who each participate in every step of the production regardless of their gender. Traditional knowledge is still based on (mainly family-owned) journals dating back to the nineteenth century and passed on through observation and hands-on practice. Stakeholders feel a strong emotional bond with their products, and the element encapsulates a sense of pride in long-lasting family traditions.",N/A,https://ich.unesco.org/doc/download.php?versionID=50674
Bobbin lacemaking in Slovenia,Slovenia,"Bobbin lacemaking in Slovenia is a handicraft skill of making lace by crossing and twisting thread wound on special wooden sticks known as bobbins. Using locally recognizable patterns with local names, bobbin lacemakers make lace in bands or in finished shapes. The bobbin lacemaking process follows a specific pattern: a drawing on paper is attached to a cylinder pillow in a wicker basket or on a wooden base. The lace is used to adorn clothing and fashion accessories, church and home textiles and representative spaces, but bobbin lacemaking also serves as an inspiration for artistic creations in fields such as the contemporary visual arts, design, architecture and culinary design. It is the creative expression of all those involved in the process, including the pattern designer and the bobbin lacemaker. Bobbin lacemaking has notable therapeutic functions, and is an ecologically clean and sustainability-oriented activity. There are around 120 bobbin lacemaking societies, sections and groups in Slovenia today, which include trained bobbin lacemakers and those who are still learning. Bearers mostly comprise women, and the knowledge and skills related to the practice are most frequently passed down from grandmothers to grandchildren: the socializing of female bobbin lacemakers in neighbourhood communities is also key for transmitting related knowledge and skills.",N/A,https://ich.unesco.org/doc/download.php?versionID=50709
Celebration in honor of the Budslaŭ icon of Our Lady (Budslaŭ fest),Belarus,"The Budslaŭ Fest takes place in Budslaŭ village, in the Minsk region. Since the seventeenth century, every year on the first weekend of July tens of thousands of pilgrims from all over Belarus and other countries have come to Budslaŭ to participate in the celebrations in honor of the Budslaŭ icon of Our Lady, with some making the pilgrimage on foot. The Icon, the patroness of Belarusian people, is known for many miracles and Budslaŭ is recognized as the place where, according to legend, Our Lady appeared to believers in July 1588. Elements of the celebration include priests welcoming the pilgrims, masses, a night procession with the Icon and candles, a youth prayer vigil, and hours of prayer to the Mother of God. The tradition is an integral part of the history and culture of the local community of Budslaŭ, with bearers including people of all ages and social statuses. It attracts entire families and believers of all ages, which helps strengthen intergenerational ties. Related knowledge is preserved and transmitted by local inhabitants, who are very proud of the relic; they show pilgrims a warm welcome, inviting them to local homes to share meals with them. Pilgrims visiting Budslaŭ learn all about the local traditional culture, including the ceremony and local traditions such as crafts, customs and cuisine. ",N/A,https://ich.unesco.org/doc/download.php?versionID=50677
"Chakan, embroidery art in the Republic of Tajikistan",Tajikistan,"The art of Chakan embroidery is the practice of sewing ornaments, images of flowers and symbolic drawings with colourful threads on cotton or silk fabrics. The tradition is widespread among women and girls in Tajikistan. Chakan embroidery is used to decorate clothing and household items such as women’s shirts, headscarves, curtains, pillows, bedspreads and coverlets for cradles. The embroidery features symbolic depictions and mythological images relating to the surrounding nature and cosmos, which express people’s wishes and hopes. The practice involves selecting the textile and threads, drawing ornaments, creating needlepoint images and sewing clothes. In the past, the threads were prepared from cotton and silk fibres and coloured with natural paints made with plants and minerals: nowadays, Chakan dressmakers use fabric threads for needlework. In the Khatlon region, the Chakan shirt is an important bridal dress. Grooms wear a ‘tāqi’ (the national skullcap featuring Chakan embroidery), and Tajik women and girls wear the Chakan dress during traditional festivals and holidays. The embroidered products are an expression of beauty, elegance and the unity of humans and nature. The young generation learn the art from their mothers, grandmothers and older sisters, and transmission also occurs in groups through the so-called ‘ustod-shogird’ (master-student) method. Individual craftswomen sell their products in bazaars and through dress shops, providing an important way of earning.",N/A,https://ich.unesco.org/doc/download.php?versionID=50713
"Chidaoba, wrestling in Georgia",Georgia,"Chidaoba (wrestling) is an ancient form of martial art practised by a large proportion of the male population throughout all the regions, villages and communities of Georgia. Bearers of the tradition include young people, city residents, sports clubs, educational institutions and amateur organizations. The practice is a complex phenomenon that combines elements of wrestling, music, dance and special garments (‘chokha’). Having had a combat function until the late Middle Ages, Chidaoba gradually became a spectacular sport. Tournaments take place in an open-air arena, surrounded by a large audience, accompanied by a wind instrument (‘zurna’) and Georgian drum (‘doli’) music, which marks the beginning. Wrestlers attempt to defeat each other through special holds, and vibrant music enhances the dynamics of the contest. The code of conduct is chivalric, and occasionally the wrestlers leave the arena with a Georgian folk dance. Chidaoba uses an important number of special wrestling holds: there are an estimated 200 such holds and counter-holds, the combination of which speaks to the wrestlers’ creativity. The practice encourages a healthy lifestyle and plays an important role in intercultural dialogue. From early spring to autumn, young people practise wrestling outdoors, mastering skills previously acquired by watching matches, and there are wrestling sections in almost every village and city of Georgia.",N/A,https://ich.unesco.org/doc/download.php?versionID=50685
Dondang Sayang,Malaysia,"Dondang Sayang is a traditional Malay art still practised in Melaka by four communities: the Malay, Baba Nyonya, Chitty and Portuguese communities. The practice combines elements of music (violins, gongs and tambourines or the tambour), songs and chants, and features beautiful melodious strains of poetry. Also known as love ballads, the songs are used by communities to convey feelings of love and give advice on special topics such as love and kindness. During the Melaka Sultanate era in the fifteenth century, Dondang Sayang was performed at Royal Palace ceremonies and events; subsequently, the performance became widespread among the communities concerned. Based on tradition, Dondang Sayang performances are accompanied by music and sung by two singers of the opposite sex, who sing in quatrains. Typically, Dondang Sayang singers are individuals who are highly competent and skilled in poetry recitation. Dongdang Sayang performances are open to all, irrespective of age, occupation, status or religion, and the art is considered as a means of conveying positive messages and sharing feelings of love, joy and sorrow that strengthen community bonding. Performances are held on a regular basis, especially during gatherings, festivals and parties, and nowadays many cultural programmes, activities and training activities are organized for those interested in participating and improving their singing and performance skills.",N/A,https://ich.unesco.org/doc/download.php?versionID=50699
Festivity of Las Parrandas in the centre of Cuba,Cuba,"Held for the first time in 1820 in the town of Remedios, the Festivity of Las Parrandas is now celebrated by eighteen communities in the centre of Cuba, mostly taking place towards the final months of the year. The Parrandas is a cultural competition between the two neighbourhoods or parties into which each town is divided, with ‘spies’ attempting to spoil the surprise of the opposing neighbourhood on the night of the festivity. The two parties work all year long to prepare for the competition, which takes place on the night of the Festivity of Las Parrandas. The festivities involve a wide range of expressions, including: the design and construction of replicas and monuments, floats and costumes; songs and dances; fireworks; and decorations such as lamps, lanterns, banners and emblems allegoric to each neighbourhood. Everyone in the eighteen communities, regardless of their social class, gender, age, religion, profession or background, is involved in the festivities, and the monuments, replicas of monuments and floats constitute a spectacular display of the imagination and creativity of the groups, who recreate and re-enact stories using lights, colours and shapes. Traditional knowledge and skills related to the element are constantly combined with new elements, meaning that Las Parrandas are always traditional and contemporary at the same time.",N/A,https://ich.unesco.org/doc/download.php?versionID=50682
